{
  "$schema": "../../schema/competition.schema.json",
  "schemaVersion": "1.0",
  "datasetId": "europe-evaluation-25",
  "id": "europe-hard",
  "shortName": "Hard",
  "name": "European Evaluation — Hard",
  "description": "Eight European rural or village scenes without a uniquely identifying clue at first inspection.",
  "splitIfNeeded": false,
  "openGuessr": {
    "roundLengthSeconds": 180,
    "duration": "2d",
    "visibility": "private",
    "restriction": "moving-allowed"
  },
  "locations": [
    {
      "id": "loc_018",
      "country": "Greece",
      "city_or_region": "Arcadia Regional Unit, Peloponnese",
      "scene_type": "rural",
      "difficulty": "hard",
      "primary_clue_type": "landscape",
      "selection_notes": "Random road",
      "google_maps_link": "https://www.google.com/maps/@37.3439407,22.5909077,3a,80.9y,21.39h,90t/data=!3m7!1e1!3m5!1s2gqAD1q93fQdgd7BKJgt7g!2e0!6shttps:%2F%2Fstreetviewpixels-pa.googleapis.com%2Fv1%2Fthumbnail%3Fcb_client%3Dmaps_sv.tactile%26w%3D900%26h%3D600%26pitch%3D0%26panoid%3D2gqAD1q93fQdgd7BKJgt7g%26yaw%3D21.39134486378221!7i16384!8i8192?entry=ttu&g_ep=EgoyMDI2MDgwNS4xIKXMDSoASAFQAw%3D%3D"
    },
    {
      "id": "loc_019",
      "country": "Romania",
      "city_or_region": "Vurpăr, Sibiu County",
      "scene_type": "rural",
      "difficulty": "hard",
      "primary_clue_type": "architecture",
      "selection_notes": "Random village Vurpar road",
      "google_maps_link": "https://www.google.com/maps/@45.8911426,24.3372001,3a,75y,207.45h,90t/data=!3m7!1e1!3m5!1sgixVtPPbDQXrrrkQ3WOf_Q!2e0!6shttps:%2F%2Fstreetviewpixels-pa.googleapis.com%2Fv1%2Fthumbnail%3Fcb_client%3Dmaps_sv.tactile%26w%3D900%26h%3D600%26pitch%3D0%26panoid%3DgixVtPPbDQXrrrkQ3WOf_Q%26yaw%3D207.45391249498374!7i16384!8i8192?entry=ttu&g_ep=EgoyMDI2MDgwNS4xIKXMDSoASAFQAw%3D%3D"
    },
    {
      "id": "loc_020",
      "country": "Bulgaria",
      "city_or_region": "Vărbina, Madan Municipality, Smolyan Province",
      "scene_type": "rural",
      "difficulty": "hard",
      "primary_clue_type": "architecture",
      "selection_notes": "Random viallge entry of Varbina",
      "google_maps_link": "https://www.google.com/maps/@41.5643939,24.9701484,3a,75y,214.08h,90t/data=!3m7!1e1!3m5!1sLCCbKvP2_4IMImalWwPpeA!2e0!6shttps:%2F%2Fstreetviewpixels-pa.googleapis.com%2Fv1%2Fthumbnail%3Fcb_client%3Dmaps_sv.tactile%26w%3D900%26h%3D600%26pitch%3D0%26panoid%3DLCCbKvP2_4IMImalWwPpeA%26yaw%3D214.07584960724188!7i16384!8i8192!5m1!1e4?entry=ttu&g_ep=EgoyMDI2MDgwNS4xIKXMDSoASAFQAw%3D%3D"
    },
    {
      "id": "loc_021",
      "country": "Hungary",
      "city_or_region": "Csongrád District, Csongrád-Csanád County",
      "scene_type": "rural",
      "difficulty": "hard",
      "primary_clue_type": "landscape",
      "selection_notes": "Random road next to sunflower crops near Csongrad",
      "google_maps_link": "https://www.google.com/maps/@46.706018,20.0496719,3a,75y,345.66h,90t/data=!3m7!1e1!3m5!1sLJsUw8G7_EEBrO23Yjx8Uw!2e0!6shttps:%2F%2Fstreetviewpixels-pa.googleapis.com%2Fv1%2Fthumbnail%3Fcb_client%3Dmaps_sv.tactile%26w%3D900%26h%3D600%26pitch%3D0%26panoid%3DLJsUw8G7_EEBrO23Yjx8Uw%26yaw%3D345.65673435753627!7i16384!8i8192!5m1!1e4?entry=ttu&g_ep=EgoyMDI2MDgwNS4xIKXMDSoASAFQAw%3D%3D"
    },
    {
      "id": "loc_022",
      "country": "Latvia",
      "city_or_region": "Ranka Parish, Gulbene Municipality",
      "scene_type": "rural",
      "difficulty": "hard",
      "primary_clue_type": "infrastructure",
      "selection_notes": "Random forest road near Ranka",
      "google_maps_link": "https://www.google.com/maps/@57.1907677,26.1476727,3a,75y,243.5h,90t/data=!3m7!1e1!3m5!1syMgWUJ7mD5lXVux1ImCbKA!2e0!6shttps:%2F%2Fstreetviewpixels-pa.googleapis.com%2Fv1%2Fthumbnail%3Fcb_client%3Dmaps_sv.tactile%26w%3D900%26h%3D600%26pitch%3D0%26panoid%3DyMgWUJ7mD5lXVux1ImCbKA%26yaw%3D243.49939385746268!7i16384!8i8192!5m1!1e4?entry=ttu&g_ep=EgoyMDI2MDgwNS4xIKXMDSoASAFQAw%3D%3D"
    },
    {
      "id": "loc_023",
      "country": "Lithuania",
      "city_or_region": "Pašakiai, Radviliškis District Municipality, Šiauliai County",
      "scene_type": "rural",
      "difficulty": "hard",
      "primary_clue_type": "infrastructure",
      "selection_notes": "Random road near Pasakiai",
      "google_maps_link": "https://www.google.com/maps/@55.5966197,23.8297989,3a,75y,156.72h,90t/data=!3m7!1e1!3m5!1swPICxgsPW66KXbUa84ez5w!2e0!6shttps:%2F%2Fstreetviewpixels-pa.googleapis.com%2Fv1%2Fthumbnail%3Fcb_client%3Dmaps_sv.tactile%26w%3D900%26h%3D600%26pitch%3D0%26panoid%3DwPICxgsPW66KXbUa84ez5w%26yaw%3D156.71787820771468!7i13312!8i6656!5m1!1e4?entry=ttu&g_ep=EgoyMDI2MDgwNS4xIKXMDSoASAFQAw%3D%3D"
    },
    {
      "id": "loc_024",
      "country": "Denmark",
      "city_or_region": "Lemvig Municipality, Central Denmark Region",
      "scene_type": "rural",
      "difficulty": "hard",
      "primary_clue_type": "landscape",
      "selection_notes": "Random road near Rongarde",
      "google_maps_link": "https://www.google.com/maps/@56.601125,8.163942,3a,75y,94.28h,90t/data=!3m7!1e1!3m5!1szJrSlk-y7c4CGQTq8nle-w!2e0!6shttps:%2F%2Fstreetviewpixels-pa.googleapis.com%2Fv1%2Fthumbnail%3Fcb_client%3Dmaps_sv.tactile%26w%3D900%26h%3D600%26pitch%3D0%26panoid%3DzJrSlk-y7c4CGQTq8nle-w%26yaw%3D94.2773149594154!7i16384!8i8192!5m1!1e4?entry=ttu&g_ep=EgoyMDI2MDgwNS4xIKXMDSoASAFQAw%3D%3D"
    },
    {
      "id": "loc_025",
      "country": "Finland",
      "city_or_region": "Utajärvi Municipality, North Ostrobothnia",
      "scene_type": "rural",
      "difficulty": "hard",
      "primary_clue_type": "landscape",
      "selection_notes": "Random forest road near Joutsela",
      "google_maps_link": "https://www.google.com/maps/@64.942839,26.9554129,3a,75y,42.46h,90t/data=!3m8!1e1!3m6!1sCIHM0ogKEICAgICe447mIQ!2e10!3e11!6shttps:%2F%2Flh3.googleusercontent.com%2Fgpms-cs-s%2FAFP8RcNlOkOaKDxj4DidWtGpV0f5vAUMJE1oXDqL0QgGH957V15MVVKPOAZ22xAY2yq2q1R3xtG7KBTKMGqp00hw9o_VeVWEFu-cDGhFthEVkll9FG7VDqotWX7bgrxEl5mJoo4j_0I%3Dw900-h600-k-no-pi0-ya156.90717092114284-ro0-fo100!7i7680!8i3840!5m1!1e4?entry=ttu&g_ep=EgoyMDI2MDgwNS4xIKXMDSoASAFQAw%3D%3D"
    }
  ],
  "order": 3
}
